{
  "id": "quem-nao-chora-nao-mama",
  "expressao": "Quem não chora não mama",
  "intencao": "Você precisa pedir, reclamar e se manifestar para ter suas necessidades atendidas. Quem fica em silêncio é esquecido — o mundo atende quem se faz ouvir.",
  "significado": "Encoraja a pessoa tímida ou comedida a pedir o que quer, com mais convicção. Também justifica a postura barulhenta de quem briga por aumento, por atenção, por espaço.",
  "origem": "Imagem doméstica: o bebê de colo só recebe o peito ou a mamadeira quando chora. Se ficar quieto, a mãe assume que está bem e o atende por último. Provérbio antigo, comum em várias línguas.",
  "metafora_visual": "Um berço com três bebês. Dois quietos, um chorando alto. A mãe entra apressada e vai direto para o que chora — os outros dois continuam esperando.",
  "exemplos": [
    "Pede o aumento sim. Quem não chora não mama.",
    "Se você não reclama do barulho do vizinho, ele não vai parar. Quem não chora não mama.",
    "Já mandei três emails pro RH sobre o reembolso. Quem não chora não mama."
  ],
  "sinonimos": [],
  "tags": ["nacional", "informal", "assertividade", "reivindicacao"],
  "registro_emocional": "encorajador e pragmático",
  "frequencia_de_uso": "corrente",
  "equivalente_estrangeiro": {
    "idioma": "inglês",
    "expressao": "The squeaky wheel gets the grease",
    "traducao_literal": "A roda que range é a que recebe a graxa"
  }
}
