{
  "id": "quem-tem-boca-vai-a-roma",
  "expressao": "Quem tem boca vai a Roma",
  "intencao": "Se você sabe perguntar, pode chegar a qualquer lugar. Saber se comunicar abre caminho — não tenha vergonha de pedir informação, de pedir ajuda, de falar.",
  "significado": "Encoraja a pessoa retraída a usar a fala como ferramenta. Lembra que o desconhecimento se resolve perguntando, e que a timidez de pedir é um obstáculo maior do que a ignorância em si.",
  "origem": "Provérbio europeu antigo. A versão original em português, registrada desde o século XVI, era 'quem tem língua vai a Roma', referindo-se às peregrinações religiosas medievais até o Vaticano — quem soubesse perguntar pelo caminho, mesmo em terra estranha, chegaria lá. Com o tempo, 'língua' virou 'boca'.",
  "metafora_visual": "Um peregrino do interior, sozinho, num cruzamento de estradas estrangeiras. Ele não tem mapa, não fala a língua, mas para o primeiro que passa e abre a boca pra perguntar. E segue.",
  "exemplos": [
    "Não sei chegar lá, mas quem tem boca vai a Roma.",
    "Se você não sabe como pedir promoção, pergunta pro RH. Quem tem boca vai a Roma.",
    "Cheguei sozinho na cidade sem conhecer ninguém — quem tem boca vai a Roma."
  ],
  "sinonimos": [],
  "tags": ["nacional", "neutro", "comunicacao", "iniciativa"],
  "registro_emocional": "encorajador e otimista",
  "frequencia_de_uso": "corrente"
}
