{
  "id": "de-grao-em-grao-a-galinha-enche-o-papo",
  "expressao": "De grão em grão, a galinha enche o papo",
  "intencao": "Progresso vem do esforço pequeno e constante. Resultado grande se constrói com paciência cumulativa — não tem mágica, tem repetição.",
  "significado": "Anima quem está num processo lento e visível só no acumulado: poupar dinheiro, perder peso, aprender um idioma, escrever um livro. Cada grão parece pouco, mas a soma enche.",
  "origem": "Provérbio popular registrado desde o Portugal medieval. Observação direta do quintal: a galinha bica o chão pequena bicada por pequena bicada, e ao fim do dia tem o papo cheio. O papo é o saco esofágico onde a ave armazena o alimento antes da digestão.",
  "metafora_visual": "A galinha no terreiro, ao sol, bicando o chão num ritmo paciente e teimoso — um grão, outro grão, outro grão — e o papo, debaixo do pescoço, inchando aos poucos.",
  "exemplos": [
    "Estou guardando trinta reais por semana. Parece pouco, mas de grão em grão a galinha enche o papo.",
    "Cinco minutos de inglês por dia. De grão em grão a galinha enche o papo.",
    "Ele lê dez páginas todo dia antes de dormir. De grão em grão a galinha enche o papo."
  ],
  "sinonimos": [],
  "tags": ["nacional", "neutro", "perseveranca", "paciencia"],
  "registro_emocional": "encorajador e paciente",
  "frequencia_de_uso": "corrente"
}
