{
  "id": "cavalo-dado-nao-se-olha-os-dentes",
  "expressao": "A cavalo dado não se olham os dentes",
  "intencao": "O que se recebe de graça não se avalia com rigor. Aceite o presente sem reclamar do tamanho, da cor ou da qualidade — gratidão antes de crítica.",
  "significado": "Usado para repreender, com leveza, quem ganha algo e em vez de agradecer começa a apontar defeitos. Lembra que o dado tem o valor do gesto, não do mercado.",
  "origem": "A idade e a saúde de um cavalo se avaliavam pela dentição — quanto mais desgastados os dentes, mais velho o animal. Ao comprar, o negociante puxava o lábio do cavalo para conferir. Mas se o animal foi presente, esse exame se tornava um insulto: estaria a calcular o valor de algo que não custou nada. O provérbio aparece em latim em São Jerônimo (século IV): 'Equi donati dentes non inspiciuntur'.",
  "metafora_visual": "Alguém recebe a corda do cavalo de presente, dá um passo pra trás, levanta o lábio do bicho com o polegar e começa a contar os dentes. O presenteador, ao lado, olha para o chão.",
  "exemplos": [
    "Sua avó te deu uma blusa que você não usaria nem morto — guarda no armário e agradece, cavalo dado não se olha os dentes.",
    "Ganhou ingresso de graça do show e tá reclamando da fila? Cavalo dado não se olha os dentes.",
    "A empresa deu bônus menor do que o esperado, mas deu. Cavalo dado não se olham os dentes."
  ],
  "sinonimos": [],
  "tags": ["nacional", "neutro", "gratidao", "presente"],
  "registro_emocional": "repreensivo brando",
  "frequencia_de_uso": "corrente",
  "equivalente_estrangeiro": {
    "idioma": "inglês",
    "expressao": "Don't look a gift horse in the mouth",
    "traducao_literal": "Não olhe um cavalo presenteado dentro da boca"
  }
}
