{
  "id": "quem-com-ferro-fere-com-ferro-sera-ferido",
  "expressao": "Quem com ferro fere, com ferro será ferido",
  "intencao": "O mal que você faz aos outros tende a voltar pra você. Violência semeada gera violência colhida — a forma como você trata o mundo é a forma como o mundo te tratará.",
  "significado": "Aviso moral e ameaça velada. Pode ser dito por quem espera que a injustiça seja paga, ou por quem se conforta vendo o algoz finalmente colher o que plantou.",
  "origem": "Provérbio de origem bíblica direta. No Evangelho de Mateus, capítulo 26, versículo 52, Jesus diz a Pedro ao ver o discípulo desembainhar a espada: 'Todos os que lançarem mão da espada, à espada perecerão'. A versão em português substituiu espada por ferro, generalizando.",
  "metafora_visual": "Um homem afia uma faca por anos, fere com ela. Um dia, deita pra dormir e a mesma faca, na mão de outro, encosta no seu pescoço. O metal é o mesmo.",
  "exemplos": [
    "Ele passou a vida traindo sócios. Agora foi traído na partilha — quem com ferro fere, com ferro será ferido.",
    "Ela humilhou o estagiário por anos. Hoje trabalha pra ele. Quem com ferro fere, com ferro será ferido.",
    "Não desejo o mal de ninguém, mas quem com ferro fere, com ferro será ferido."
  ],
  "sinonimos": [],
  "tags": ["nacional", "neutro", "justica", "karma", "biblico"],
  "registro_emocional": "solene, com tom de sentença",
  "frequencia_de_uso": "corrente",
  "equivalente_estrangeiro": {
    "idioma": "inglês",
    "expressao": "Live by the sword, die by the sword",
    "traducao_literal": "Quem vive pela espada, morre pela espada"
  }
}
