{
  "id": "pimenta-nos-olhos-dos-outros-e-refresco",
  "expressao": "Pimenta nos olhos dos outros é refresco",
  "intencao": "É fácil minimizar o sofrimento alheio porque a gente não está sentindo. Quem não vive a dor acha que ela é menor do que parece — quem vive, sabe que arde.",
  "significado": "Usado para apontar a desproporção entre o jeito como a pessoa trata o próprio sofrimento e o sofrimento dos outros. Quem fala muitas vezes está chamando o outro de insensível, ou se denunciando.",
  "origem": "Provérbio antigo, comum em todo o mundo lusófono. A pimenta nos olhos arde de verdade, lacrimeja, queima — mas se for nos olhos de outro, dá pra rir, contar como anedota, achar graça. Refresco aqui no sentido antigo de bebida fresca, algo aliviante.",
  "metafora_visual": "Duas pessoas: uma com os olhos vermelhos e lacrimejantes, esfregando o rosto desesperada; a outra ao lado, copo de água gelada na mão, comentando 'ah, mas nem foi tanto assim, não'.",
  "exemplos": [
    "Quando foi com o irmão dela ela ficou três dias chorando, mas comigo ela manda 'supera' — pimenta nos olhos dos outros é refresco.",
    "É fácil dizer pra pedir demissão quando não é você que tem boleto pra pagar. Pimenta nos olhos dos outros é refresco.",
    "O chefe acha que prazo apertado é motivacional. Pimenta nos olhos dos outros é refresco."
  ],
  "sinonimos": [],
  "tags": ["nacional", "informal", "empatia", "critica"],
  "registro_emocional": "indignado e acusatório",
  "frequencia_de_uso": "corrente"
}
