{
  "id": "farinha-pouca-meu-pirao-primeiro",
  "expressao": "Farinha pouca, meu pirão primeiro",
  "intencao": "Quando os recursos são escassos, eu cuido de mim antes dos outros. Declaração aberta de pragmatismo egoísta em momento de escassez, sem fingir generosidade.",
  "significado": "Numa situação onde não há o bastante para todos, a pessoa anuncia que vai garantir a própria parte primeiro. É uma confissão sem cerimônia: pode até parecer feio, mas é como vai ser.",
  "origem": "Vem do cotidiano da cozinha popular do Norte e Nordeste do Brasil. O pirão é feito com farinha de mandioca dissolvida em caldo quente — geralmente o caldo do peixe ou da carne. Em famílias grandes e épocas de aperto, a farinha era racionada. Quem chegava à panela primeiro, com farinha pouca, fazia o próprio pirão antes de sobrar só caldo ralo para os outros.",
  "metafora_visual": "A panela quase vazia de farinha, o caldo fervendo, várias mãos esperando — e a sua colher entrando primeiro, sem disfarce, para encher o próprio prato.",
  "exemplos": [
    "Tem dois pedaços de bolo e quatro pessoas chegando — farinha pouca, meu pirão primeiro.",
    "O chefe disse que só pode promover um da equipe esse ano. Pode chamar de feio, mas farinha pouca, meu pirão primeiro.",
    "Não vou dividir essa última cerveja não, meu amigo. Farinha pouca, meu pirão primeiro."
  ],
  "sinonimos": [],
  "tags": ["nordeste", "informal", "pragmatico", "escassez"],
  "registro_emocional": "pragmático e sem-cerimônia, com humor autoirônico",
  "frequencia_de_uso": "corrente"
}
