{
  "id": "macaco-velho-nao-poe-a-mao-em-cumbuca",
  "expressao": "Macaco velho não põe a mão em cumbuca",
  "intencao": "Quem tem experiência evita armadilhas óbvias. Veterano não cai em truque que já viu antes — a malícia aprendida custa caro e por isso é preservada.",
  "significado": "Diz-se da pessoa que, por experiência prévia, recusa uma proposta, uma situação ou uma tentação que aos olhos dos mais jovens parece inocente. Não é covardia, é cicatriz.",
  "origem": "Vem de uma técnica antiga de captura de macacos em algumas regiões da África e da América: amarrava-se uma cumbuca (cuia, vaso de boca estreita) com fruta dentro. O macaco enfiava a mão para pegar a fruta, mas com o punho fechado a mão não saía mais. Ele não largava a fruta — e era capturado. O macaco velho, já tendo visto outros caírem nesse golpe, não enfia a mão.",
  "metafora_visual": "A cumbuca presa ao tronco da árvore, a fruta visível lá dentro. O macaco velho parado, olhando, sem se mexer. Os jovens lá no alto, curiosos. Ele já viu esse filme.",
  "exemplos": [
    "Já me ofereceram esse tipo de sociedade três vezes e foi sempre rolo. Macaco velho não põe a mão em cumbuca.",
    "Promoção 'imperdível' com prazo de duas horas? Macaco velho não põe a mão em cumbuca.",
    "Ele recusou subir de cargo sem aumento — macaco velho não põe a mão em cumbuca."
  ],
  "sinonimos": [],
  "tags": ["nacional", "informal", "experiencia", "malicia"],
  "registro_emocional": "calmo e confiante",
  "frequencia_de_uso": "corrente"
}
